text,risk_score
Central bank signals potential interest rate cuts due to slowing inflation.,-0.323592688776323
Unemployment rate rises unexpectedly as job market weakens.,-0.1871346739674018
GDP growth forecasts revised downward amid global demand slowdown.,0.10423660165219883
Energy prices surge following geopolitical tensions.,-0.11431690272810474
Consumer confidence improves as financial conditions ease.,-0.04207532563915428
Corporate bankruptcy filings increase as borrowing costs remain elevated.,-0.28671642861552704
Manufacturing output contracts for third straight month.,0.021576806094326995
Stock markets rally as recession fears decline.,-0.2029709279332536
